<?xml version="1.0" encoding="UTF-8"?>

<lexeme id="loch" xmlns:xsi="http://www.w3.org/2001/XMLSchema-instance" xsi:noNamespaceSchemaLocation="../lexeme.xsd">
    <form>
      <orth>loch</orth>
    </form>
    <form>
      <orth>locha</orth>
    </form>
    <form>
      <orth>lochan</orth>
    </form>
    <trans>lake</trans>
    <trans>loch</trans>
    <note>Listed in An Seotal: Geography.</note>
  </lexeme>
