<?xml version="1.0" encoding="UTF-8"?>

<lexeme id="prionnsapal" xmlns:xsi="http://www.w3.org/2001/XMLSchema-instance" xsi:noNamespaceSchemaLocation="../lexeme.xsd">
    <form>
      <orth>prionnsapal</orth>
    </form>
    <trans>principal</trans>
    <trans>principle</trans>
    <note>Listed in An Seotal: General.</note>
    <note>principal - prionnsapail poss cprincipals - prionnsapail plprincipals - prionnsapalan pl</note>
    <note>principle - prionnsapail poss cprinciples - prionnsapalan pl</note>
  </lexeme>
