<?xml version="1.0" encoding="UTF-8"?>

<lexeme id="teaghlach" xmlns:xsi="http://www.w3.org/2001/XMLSchema-instance" xsi:noNamespaceSchemaLocation="../lexeme.xsd">
    <form>
      <orth>teaghlach</orth>
    </form>
    <form>
      <orth>teaghlaich</orth>
    </form>
    <form>
      <orth>teaghlaichean</orth>
    </form>
    <trans>family</trans>
    <trans>household</trans>
    <note>Listed in An Seotal: General, as 'family'.</note>
  </lexeme>
