<?xml version="1.0" encoding="UTF-8"?>

<lexeme id="cuideachd-noun" xmlns:xsi="http://www.w3.org/2001/XMLSchema-instance" xsi:noNamespaceSchemaLocation="../lexeme.xsd">
    <form>
      <orth>cuideachd</orth>
    </form>
    <trans>company</trans>
    <trans>party</trans>
    <trans>troop</trans>
    <trans>body</trans>
    <trans>society</trans>
    <trans>train</trans>
  </lexeme>
