<?xml version="1.0" encoding="UTF-8"?>

<ainmear_fireann id="lagh" xmlns:xsi="http://www.w3.org/2001/XMLSchema-instance" xsi:noNamespaceSchemaLocation="../lexeme.xsd">
    <form>
      <orth>lagh</orth>
    </form>
    <trans>law</trans>
    <note>Listed in An Seotal: General.</note>
    <note>law - lagha poss c laws - laghannan pl</note>
    <note>Listed in TYGD.</note>
    <note>Listed in CM.</note>
  </ainmear_fireann>
