<?xml version="1.0" encoding="UTF-8"?>

<lexeme id="craobh_fheòir" xmlns:xsi="http://www.w3.org/2001/XMLSchema-instance" xsi:noNamespaceSchemaLocation="../lexeme.xsd">
  <part ref="craobh"/>
  <part ref="feur"/>
  <form>
    <orth>craobh fheòir</orth>
  </form>
  <trans>grass tree</trans>
  <trans>lancewood</trans>
  <trans>Pseudopanax crassifolius</trans>
  <note>Mac-Thalla VIII (1899) No. 13 100/4: "Thugadh dha bata craobh fheoir (grass tree) New Zealand air a dheanamh sgiamhach le or, le deadh ruin a chomuinn".</note>
</lexeme>
